{
  "schema_version": "eino.provider_policy_decision.v1",
  "allowed": true,
  "reason_code": "approval_required",
  "policy_ref": "policy:fobrain:ticket-mutation:v1",
  "audit_ref": "audit-policy-approval-1",
  "approval_required": true,
  "safe_summary": "更新工单状态需要审批。",
  "credential_binding": {
    "schema_version": "eino.provider_credential_binding.v1",
    "workspace_id": "ws-demo",
    "system": "fobrain",
    "status": "bound",
    "display_ref": "bound:fobrain:workspace-binding",
    "owner_scope": "workspace",
    "updated_at": "2026-06-30T00:00:00Z",
    "audit_ref": "audit-credential-1"
  }
}
